{
  "ok": true,
  "window": "custom",
  "filters": {
    "start": "2025-02-20T06:31:09.178Z",
    "end": "2025-04-26T06:31:09.178Z",
    "include_unlinked": true
  },
  "totals": {
    "prompt_tokens": 0,
    "completion_tokens": 0,
    "total_tokens": 0,
    "cost_usd": 0,
    "unlinked_events": 0,
    "linked_events": 0,
    "event_count": 0
  },
  "by_agent": [],
  "by_task": [],
  "by_model": [],
  "trend": []
}
